{
  "$schema": "https://json-schema.org/draft/2020-12/schema",
  "title": "XBearInstance",
  "description": "实例配置。Windows 端与 Android 端共用，平台特有字段置于 platformConfig 逃生舱。",
  "type": "object",
  "required": ["schemaVersion", "id", "displayName", "platform", "imageRef", "resources"],
  "additionalProperties": false,
  "properties": {
    "schemaVersion": {
      "type": "string",
      "pattern": "^\\d+\\.\\d+\\.\\d+$"
    },
    "id": {
      "type": "string",
      "pattern": "^[a-z0-9][a-z0-9-]{1,62}[a-z0-9]$",
      "description": "全局唯一标识，删除后进墓碑记录不得自动复用"
    },
    "displayName": {
      "type": "string",
      "minLength": 1,
      "maxLength": 64
    },
    "platform": {
      "enum": ["windows", "android"]
    },
    "imageRef": {
      "type": "string",
      "description": "引用 image.schema.json 中的 id"
    },
    "resources": {
      "type": "object",
      "required": ["memoryMB", "cpuCores"],
      "properties": {
        "memoryMB":  { "type": "integer", "minimum": 512, "maximum": 16384 },
        "cpuCores":  { "type": "integer", "minimum": 1, "maximum": 64 },
        "diskGB":    { "type": "integer", "minimum": 4, "maximum": 512 },
        "cpuModel":  {
          "type": ["string", "null"],
          "minLength": 1,
          "maxLength": 64,
          "description": "QEMU -cpu 型号。缺省由平台按镜像的指令集要求选型，选出的型号必须同时被 WHPX 接受且含镜像要求的指令集。Android-x86 系镜像要求 SSE4.2，默认 qemu64 缺失会导致系统主动拒绝引导。"
        }
      }
    },
    "network": {
      "type": "object",
      "properties": {
        "portForwards": {
          "type": "array",
          "items": {
            "type": "object",
            "required": ["hostPort", "guestPort", "protocol"],
            "properties": {
              "hostPort":  { "type": "integer", "minimum": 1, "maximum": 65535 },
              "guestPort": { "type": "integer", "minimum": 1, "maximum": 65535 },
              "protocol":  { "enum": ["tcp", "udp"] },
              "bind":      { "enum": ["loopback", "lan", "public"] }
            }
          }
        },
        "fixedAddress": {
          "type": ["string", "null"],
          "pattern": "^(?:(?:25[0-5]|2[0-4][0-9]|1[0-9][0-9]|[1-9]?[0-9])\\.){3}(?:25[0-5]|2[0-4][0-9]|1[0-9][0-9]|[1-9]?[0-9])(?:\\/(?:3[0-2]|[12]?[0-9]))?$",
          "description": "实例的固定地址，形式为 IPv4 地址或 IPv4 地址加前缀长度。取宿主网络仿真的默认网段会把它写进实例，属可被交叉校验命中的暴露面，因此契约不预设网段，只要求取值合法；地址不得随启动顺序漂移。前缀缺省时由产品按选定的网段补齐。"
        },
        "proxy": {
          "type": ["object", "null"],
          "properties": {
            "type": { "enum": ["http", "https", "socks5", "pac"] },
            "host": { "type": "string" },
            "port": { "type": "integer", "minimum": 1, "maximum": 65535 },
            "url":  { "type": "string", "description": "pac 类型时使用" }
          }
        },
        "exposure": {
          "enum": ["loopback", "lan", "public"],
          "default": "loopback",
          "description": "public 需阻断式二次确认"
        }
      }
    },
    "deviceIdentity": {
      "type": ["object", "null"],
      "description": "每实例强制独立的设备身份。省略或为 null 表示用户未手工指定，由产品在创建实例时生成并写入，不表示该实例无身份；一旦存在则 serialNo 与 androidId 必须齐全，半截身份一律拒绝——标识只生成一半时相关下发通道会静默失效，实例对外呈现为空序列号。生成规则与格式定义见 identity.schema.json。",
      "required": ["serialNo", "androidId"],
      "additionalProperties": false,
      "properties": {
        "serialNo": {
          "type": "string",
          "pattern": "^XBSN[0-9A-F]{12}$",
          "minLength": 16,
          "maxLength": 16,
          "description": "设备序列号。恒为 XBSN 加 12 位大写十六。经 SMBIOS type=1/2/3 的 serial 与内核命令行 androidboot.serialno 下发，是唯一在 AOSP 有标准消费方的标识字段。同实例跨重启恒定。"
        },
        "androidId": {
          "type": "string",
          "pattern": "^[0-9a-f]{16}$",
          "minLength": 16,
          "maxLength": 16,
          "description": "Android ID。16 位小写十六，大小写敏感。AOSP 无内核引导期消费方，必须经实例内设置库落地后回读校验，仅下发不生效。跨实例互不相同。"
        },
        "imei": {
          "type": ["string", "null"],
          "pattern": "^86[0-9]{12}[0-9]$",
          "minLength": 15,
          "maxLength": 15,
          "description": "IMEI。恒为 15 位、国家码 86、末位为 Luhn 校验位。仅当所引用镜像实测具备 telephony 能力时填写，否则必须为 null；为 null 时不得向内核命令行下发该键，否则制造「声明存在却无人消费」的矛盾。"
        },
        "mac": {
          "type": ["string", "null"],
          "pattern": "^([0-9a-f]{2}:){5}[0-9a-f][02468aAcCeE]$",
          "not": { "type": "string", "pattern": "^00:00:00:00:00:00$" },
          "description": "网卡 MAC。6 字节小写十六冒号分隔，末字节取偶数位（组播位为字节最低位，为 0 才表示单播），全零亦被拒。省略或为 null 时由 serialNo 确定性派生，实例首次创建后固定不变：同实例跨重启恒定，跨实例唯一；MAC 逐次跳变本身就是异常特征。"
        },
        "deviceProfileId": {
          "type": ["string", "null"],
          "pattern": "^[a-z0-9][a-z0-9-]{1,62}$",
          "description": "机型族标识，引用 identity.schema.json 的机型族画像。省略或为 null 时按实例序号确定性选取；同机型族实例之间仍需靠 serialNo、androidId、mac 区分。"
        },
        "identityVersion": {
          "type": "string",
          "pattern": "^\\d+\\.\\d+\\.\\d+$",
          "description": "所引用的 identity.schema 版本。产品读入时若高于自身支持的版本，按未识别处理并保留原始字段，不得静默丢弃。"
        }
      }
    },
    "display": {
      "type": "object",
      "description": "实例的显示设置。缺省时由平台按镜像的显示能力选型；分辨率、像素密度与方向在实例运行期间不可改，改动后需下次启动生效。",
      "required": ["width", "height"],
      "properties": {
        "width":  { "type": "integer", "minimum": 1, "maximum": 7680, "description": "画面宽度，单位像素" },
        "height": { "type": "integer", "minimum": 1, "maximum": 4320, "description": "画面高度，单位像素" },
        "dpi":    { "type": "integer", "minimum": 72, "maximum": 1280, "description": "像素密度，单位 dpi。缺省时由平台按镜像的显示能力选型" },
        "orientation": {
          "enum": ["landscape", "portrait", "auto"],
          "default": "auto",
          "description": "屏幕方向。landscape = 横屏，portrait = 竖屏，auto = 跟随宿主系统方向"
        }
      }
    },
    "platformConfig": {
      "type": "object",
      "description": "平台特有字段逃生舱，通用 Schema 只保证其为 object，不解析内部结构",
      "properties": {
        "initrdImage": {
          "type": "string",
          "description": "初始 ramdisk 文件路径/引用。与 kernelImage 配对；声明了 kernelImage 时强烈建议同时声明，但契约层面保持可选"
        },
        "kernelAppend": {
          "type": "string",
          "description": "内核命令行骨架与自定义参数（如 root=/dev/ram0 quiet nomodeset）"
        }
      }
    }
  }
}
