{
  "schemaVersion": "1.1.0",
  "id": "and-main-01",
  "displayName": "主力实例",
  "platform": "android",
  "imageRef": "xbear-rom-aosp-14",
  "resources": {
    "memoryMB": 3072,
    "cpuCores": 4,
    "diskGB": 32
  },
  "network": {
    "portForwards": [
      { "hostPort": 25555, "guestPort": 5555, "protocol": "tcp", "bind": "loopback" }
    ],
    "fixedAddress": "10.0.2.15",
    "proxy": {
      "type": "socks5",
      "host": "127.0.0.1",
      "port": 7890
    },
    "exposure": "loopback"
  },
  "deviceIdentity": {
    "serialNo": "XBSN5D8E4A0C7B2E",
    "androidId": "b7e1d93f05a24c18"
  },
  "platformConfig": {
    "containerRuntime": "system-level",
    "rootProvider": "container",
    "renderBackend": "virtio-gpu"
  }
}