{
  "schemaVersion": "1.1.0",
  "id": "win-main-01",
  "displayName": "主力实例",
  "platform": "windows",
  "imageRef": "bliss-os-17-x86_64",
  "resources": {
    "memoryMB": 4096,
    "cpuCores": 4,
    "diskGB": 64
  },
  "network": {
    "portForwards": [
      { "hostPort": 15555, "guestPort": 5555, "protocol": "tcp", "bind": "loopback" },
      { "hostPort": 18080, "guestPort": 8080, "protocol": "tcp", "bind": "lan" }
    ],
    "fixedAddress": "192.168.77.15/24",
    "proxy": {
      "type": "http",
      "host": "127.0.0.1",
      "port": 7890
    },
    "exposure": "loopback"
  },
  "deviceIdentity": {
    "serialNo": "XBSN0A1B2C3D4E5F",
    "androidId": "3f7a91c4de20b865",
    "imei": "861234567890123",
    "mac": "3a:1f:0c:9d:2b:74",
    "deviceProfileId": "xb-alpha-11",
    "identityVersion": "1.0.0"
  },
  "display": {
    "width": 1920,
    "height": 1080,
    "dpi": 240,
    "orientation": "landscape"
  },
  "platformConfig": {
    "accelerator": "whpx",
    "machine": "q35",
    "graphics": "virtio-vga-gl",
    "initrdImage": "initrd.img",
    "kernelAppend": "root=/dev/ram0 quiet nomodeset"
  }
}